{
  "$schema": "./tentacle.schema.json",
  "id": "career_concentration_check",
  "formId": "career-control-form",
  "campaignId": "employment_concentration_risk_2026q3",
  "route": {
    "path": "/career-control",
    "canonical": "https://olsonfa.com/career-control"
  },
  "dimensions": {
    "exposure": {
      "label": "Exposure / security concentration",
      "bands": [
        {
          "id": "distributed",
          "min": 0,
          "label": "not heavily dependent on one job"
        },
        {
          "id": "meaningful",
          "min": 4,
          "label": "meaningfully dependent on one job"
        },
        {
          "id": "high",
          "min": 8,
          "label": "heavily dependent on one job"
        }
      ]
    },
    "control": {
      "label": "Control gap",
      "bands": [
        {
          "id": "narrow",
          "min": 0,
          "label": "Narrow"
        },
        {
          "id": "material",
          "min": 3,
          "label": "Material"
        },
        {
          "id": "wide",
          "min": 6,
          "label": "Wide"
        }
      ]
    },
    "posture": {
      "label": "Investigation posture",
      "bands": [
        {
          "id": "observe",
          "min": 0,
          "label": "Observe and define"
        },
        {
          "id": "compare",
          "min": 3,
          "label": "Ready to compare"
        },
        {
          "id": "active",
          "min": 6,
          "label": "Active investigation"
        }
      ]
    }
  },
  "questions": [
    {
      "id": "income",
      "dimension": "exposure",
      "legend": "How much of your household income disappears if this job does?",
      "help": "Use the closest broad range.",
      "options": [
        {
          "value": "under-25",
          "label": "Less than 25%",
          "weight": 0
        },
        {
          "value": "25-49",
          "label": "25–49%",
          "weight": 1
        },
        {
          "value": "50-74",
          "label": "50–74%",
          "weight": 3,
          "driver": "one job carrying most of the household income"
        },
        {
          "value": "75-plus",
          "label": "75% or more",
          "weight": 5,
          "driver": "one job carrying most of the household income"
        }
      ]
    },
    {
      "id": "changes",
      "dimension": "exposure",
      "legend": "What is already changing around you at work?",
      "help": "Select all that apply.",
      "multi": true,
      "options": [
        {
          "value": "ai-workflow",
          "label": "AI workflow changes",
          "weight": 2,
          "driver": "AI-driven workflow changes"
        },
        {
          "value": "freeze-reorg",
          "label": "Hiring freeze or reorganization",
          "weight": 3,
          "driver": "a hiring freeze or reorganization"
        },
        {
          "value": "compressed-scope",
          "label": "Compressed role scope or headcount",
          "weight": 3,
          "driver": "a shrinking role or team"
        },
        {
          "value": "narrowing",
          "label": "Narrowing advancement or compensation",
          "weight": 2,
          "driver": "narrowing advancement or pay"
        },
        {
          "value": "none",
          "label": "None of these",
          "weight": 0
        }
      ]
    },
    {
      "id": "impact",
      "dimension": "control",
      "legend": "If the role changed or disappeared, what gets hit first?",
      "help": "Choose the practical area that would matter most.",
      "options": [
        {
          "value": "home-income",
          "label": "Household income and obligations",
          "weight": 3,
          "driver": "household obligations"
        },
        {
          "value": "benefits",
          "label": "Benefits or healthcare continuity",
          "weight": 3,
          "driver": "benefits continuity"
        },
        {
          "value": "family-plans",
          "label": "Family plans or location",
          "weight": 2,
          "driver": "family or location plans"
        },
        {
          "value": "identity",
          "label": "Professional identity and momentum",
          "weight": 2,
          "driver": "professional momentum"
        },
        {
          "value": "manageable",
          "label": "It would be manageable",
          "weight": 0
        }
      ]
    },
    {
      "id": "runway",
      "dimension": "exposure",
      "legend": "How long could your household absorb the income loss before a major decision was forced?",
      "options": [
        {
          "value": "12-plus",
          "label": "More than 12 months",
          "weight": 0
        },
        {
          "value": "6-12",
          "label": "6–12 months",
          "weight": 1
        },
        {
          "value": "3-6",
          "label": "3–6 months",
          "weight": 3,
          "driver": "limited time to absorb an income loss"
        },
        {
          "value": "under-3",
          "label": "Less than 3 months",
          "weight": 5,
          "driver": "limited time to absorb an income loss"
        }
      ]
    },
    {
      "id": "control",
      "dimension": "control",
      "legend": "What are you most tired of letting the job decide?",
      "options": [
        {
          "value": "income-ceiling",
          "label": "How much I can earn",
          "weight": 3
        },
        {
          "value": "schedule",
          "label": "When I work",
          "weight": 2
        },
        {
          "value": "location",
          "label": "Where I live or work",
          "weight": 2
        },
        {
          "value": "role-continuity",
          "label": "Whether my role survives the next reorganization",
          "weight": 3
        },
        {
          "value": "asset",
          "label": "Whether I build something I own",
          "weight": 3
        },
        {
          "value": "none",
          "label": "None of these",
          "weight": 0
        }
      ]
    },
    {
      "id": "future",
      "dimension": "posture",
      "legend": "Which path are you willing to investigate instead of just thinking about?",
      "options": [
        {
          "value": "strengthen",
          "label": "Make my current job work better",
          "weight": 1
        },
        {
          "value": "change",
          "label": "Find a different employer",
          "weight": 2
        },
        {
          "value": "diversify",
          "label": "Build another income stream",
          "weight": 3
        },
        {
          "value": "investigate",
          "label": "Explore business ownership",
          "weight": 3
        },
        {
          "value": "evaluate",
          "label": "Compare starting, buying, and franchising seriously",
          "weight": 4
        }
      ]
    },
    {
      "id": "timing",
      "dimension": "posture",
      "legend": "When do you need a real option?",
      "options": [
        {
          "value": "none",
          "label": "I do not have a deadline yet",
          "weight": 0
        },
        {
          "value": "12-months",
          "label": "Within 12 months",
          "weight": 1
        },
        {
          "value": "6-months",
          "label": "Within 6 months",
          "weight": 2
        },
        {
          "value": "under-way",
          "label": "The change is already happening",
          "weight": 3
        }
      ]
    }
  ],
  "routes": {
    "executive_leader": {
      "artifact": "Executive Ownership Decision Brief",
      "cta": "Executive Ownership Strategy Review",
      "interpretation": "Your executive background may bring decision discipline and leadership range, while ownership asks you to test how close you want to be to daily execution.",
      "criteria": [
        "Which executive strengths transfer to an owner-operator role?",
        "What decision rights must ownership add?",
        "Which models fit your capital, leadership span, and operating involvement?"
      ],
      "contradiction": "Test this: senior leadership experience does not automatically mean a semi-absentee model is the better fit.",
      "routeKey": "EXECUTIVE_OWNERSHIP_STRATEGY"
    },
    "skilled_trades_operator": {
      "artifact": "Operator-to-Owner Role Map",
      "cta": "Operator-to-Owner Fit Review",
      "interpretation": "Your operating experience may create practical credibility, but the owner role can shift from doing the work to building the system and leading people.",
      "criteria": [
        "Which field skills create an advantage without trapping you in production?",
        "How much hiring, sales, and people leadership does the model require?",
        "What operating territory and demand assumptions need proof?"
      ],
      "contradiction": "Test this: being excellent at the work is not the same as wanting the owner's job.",
      "routeKey": "SKILLED_TRADES_OPERATOR_TO_OWNER"
    },
    "portfolio_investor": {
      "artifact": "Manager-Led Diligence Brief",
      "cta": "Manager-Led Franchise Diligence Review",
      "interpretation": "Your portfolio perspective may support comparative diligence, while a manager-led franchise still requires active governance and operating accountability.",
      "criteria": [
        "What manager economics are supported after full labor costs?",
        "Which controls let you govern without pretending the asset is passive?",
        "How concentrated would capital, territory, and franchisor exposure become?"
      ],
      "contradiction": "Test this: manager-led does not mean passive, and diversification can create a new concentration.",
      "routeKey": "PORTFOLIO_GOVERNANCE_DILIGENCE"
    },
    "first_time_owner": {
      "artifact": "Start/Buy/Franchise and Owner-Role Brief",
      "cta": "First Ownership Model Review",